FID,LHB19CD,LHB19NM,LHB19NMW
1,W11000023,Betsi Cadwaladr University Health Board,Bwrdd Iechyd Prifysgol Betsi Cadwaladr
2,W11000024,Powys Teaching Health Board,Bwrdd Iechyd Addysgu Powys
3,W11000025,Hywel Dda University Health Board,Bwrdd Iechyd Prifysgol Hywel Dda
4,W11000028,Aneurin Bevan University Health Board,Bwrdd Iechyd Prifysgol Aneurin Bevan
5,W11000029,Cardiff and Vale University Health Board,Bwrdd Iechyd Prifysgol Caerdydd a’r Fro
6,W11000030,Cwm Taf Morgannwg University Health Board,Bwrdd Iechyd Prifysgol Cwm Taf Morgannwg
7,W11000031,Swansea Bay University Health Board,Bwrdd Iechyd Prifysgol Bae Abertawe
